{
  "schema_version": 1,
  "authority": {
    "scope": "standalone_human_ui",
    "source_root": "src/standalone/src",
    "target_id_prefixes": ["shell.", "view.", "document.", "dialog.", "action.", "context.", "task.", "provider."]
  },
  "gates": {
    "G1": {
      "decision": "Use exactly one root DockSpace. Central documents are stable document windows docked into root document nodes; do not create a nested document DockSpace. Workbench preserves only ordered logical views, active document, state tokens, selection and bounded navigation history; the retired document host and split tree no longer own or persist geometry. KeepAliveOnly is not required because no inactive nested DockSpace exists.",
      "evidence": [
        {"path": "src/standalone/src/core/workbench/workbench_contracts.h", "symbol": "document_kind_t; navigation_history_dto_t; append_navigation_history; history_back; history_forward", "claim": "Document identity and history are semantic contracts independent of geometry."},
        {"path": "src/standalone/src/core/ui/workspace_layout.cpp", "symbol": "prepare_root; build_default_layout", "claim": "The root DockSpace is the sole live human geometry owner and default layouts initialize without fighting saved user state."},
        {"path": "src/standalone/src/core/workbench/workbench_model.cpp", "symbol": "validate_model_state; set_focus; apply_navigation", "claim": "Flat ordered logical surfaces preserve focus, active document, selection and navigation without geometry mutation."},
        {"path": "src/standalone/src/core/workbench/workbench_persistence.cpp", "symbol": "payload_json_v10; parse_payload_json_v9; migrate_legacy_view_order", "claim": "Current writes contain semantic state only; bounded v9 decoding derives logical leaf order and discards obsolete geometry."}
      ],
      "runtime_evidence_pending": ["Dock tab split/move/close/reopen parity", "Alt+Left and Alt+Right history restoration", "workspace switch with inactive documents", "100-document stress", "native and Studio docking interaction"]
    },
    "G2": {
      "decision": "Functions Panel and Xref DB began as unreachable candidates with usable static-workspace providers and are activated through registry views. The unreachable competing Code Patcher header was retired after the registered Patches view gained complete create, apply, revert, remove, bounded code-cave discovery, diff, consequence review, readback and virtualized rendering parity against the shared backend.",
      "evidence": [
        {"path": "src/standalone/src/helpers/helpers.cpp", "symbol": "include functions_panel.hpp without functions_panel::render call", "claim": "Functions Panel is compiled into a translation unit but not rendered."},
        {"path": "src/standalone/src/core/analysis/xref_db_view.hpp", "symbol": "xref_db_view::submit_query; xref_db_view::render", "claim": "Static immutable workspace xref query/filter is cancellable; live whole-process indexing is explicitly unsupported."},
        {"path": "src/standalone/src/core/debugger/debugger_view.cpp", "symbol": "render_patches; render_code_cave_dialog; render_context_mutation_confirmation", "claim": "The reachable Patches surface owns the shared backend with bounded nonblocking snapshots, staged consequence review, verified apply/revert/remove, virtualized rows and executor-owned bounded code-cave discovery."}
      ],
      "candidates": [
        {"id": "candidate.analysis.functions_panel", "reachability": "unreachable", "backend": "static_workspace_complete", "disposition": "activate_as_view.analysis.functions"},
        {"id": "candidate.analysis.xref_db", "reachability": "unreachable", "backend": "static_workspace_complete_live_explicitly_unsupported", "disposition": "activate_as_view.analysis.references"},
        {"id": "candidate.analysis.code_patcher", "reachability": "retired_after_parity", "backend": "live_backend_complete", "disposition": "retired_to_view.debug.patches"}
      ],
      "center_alias_decision": "Every center_view_t value maps to one canonical target view plus an exact selected subview. No alias may open a hub on an unrelated tab; aliases are migration-only and are removed after persisted state is upgraded."
    },
    "G3": {
      "decision": "Register only providers proven by source: text editing/file I/O, syntax tokenization, project tree/search, a real ConPTY terminal, and exact bounded PDB source debugging. Language navigation, LSP diagnostics, formatting, refactoring, configured build/test/run, and VCS remain disabled and unregistered until a real adapter is implemented.",
      "evidence": [
        {"path": "src/standalone/src/core/editor/code_editor.cpp", "symbol": "code_editor::render; set_text; trigger_save; set_ai_proposal", "claim": "Real editor buffer, save, navigation, syntax and AI proposal review exist."},
        {"path": "src/standalone/src/helpers/helpers.cpp", "symbol": "render_file_tree_node; render_search_results; file_tabs", "claim": "Real project tree, workspace search and file documents exist."},
        {"path": "src/standalone/src/core/ui/terminal_view.hpp", "symbol": "terminal_view::create_session; TerminalManager; render_terminal", "claim": "Real Windows pseudoconsole terminal exists."},
        {"path": "src/standalone/src/core/debugger/source_debug_service.cpp", "symbol": "resolve_locations; reconcile_locked; resolve_current_location; begin_frame", "claim": "Exact PDB file-line resolution, persistent source breakpoints, stopped-address synchronization, bounded source loading and worker-owned target operations are implemented."}
      ],
      "capabilities": [
        {"id": "text_edit", "status": "available", "provider_symbol": "code_editor::render", "register_ui": true},
        {"id": "syntax_tokenization", "status": "available", "provider_symbol": "syntax::tokenize", "register_ui": true},
        {"id": "project_tree", "status": "available", "provider_symbol": "render_file_tree_node", "register_ui": true},
        {"id": "workspace_text_search", "status": "available", "provider_symbol": "render_search_results", "register_ui": true},
        {"id": "terminal", "status": "available", "provider_symbol": "terminal_view::create_session", "register_ui": true},
        {"id": "language_navigation", "status": "absent", "provider_symbol": "", "register_ui": false},
        {"id": "lsp_diagnostics", "status": "absent", "provider_symbol": "", "register_ui": false},
        {"id": "formatting", "status": "absent", "provider_symbol": "", "register_ui": false},
        {"id": "refactoring", "status": "absent", "provider_symbol": "", "register_ui": false},
        {"id": "configured_build_test_run", "status": "absent", "provider_symbol": "", "register_ui": false},
        {"id": "source_debugging", "status": "available", "provider_symbol": "source_debug_service::begin_frame", "register_ui": true},
        {"id": "version_control", "status": "absent", "provider_symbol": "", "register_ui": false}
      ]
    },
    "G4": {
      "decision": "The Task Center is a read-only projection over existing executors. Cancel is visible only when the submitting owner registers a safe cancellation adapter for that exact handle. Runtime cancellation merely requests cancellation and the UI remains Requested until the owner reports terminal state. Security, license, ARC, integrity, heartbeat, driver guard, and shutdown work never opt in.",
      "evidence": [
        {"path": "src/standalone/src/core/infra/taskflow_runtime.hpp", "symbol": "job_handle_t; task_descriptor_t::cancellable_body; active_snapshot; cancel(job_handle_t)", "claim": "The runtime exposes bounded snapshots and cooperative handle cancellation."},
        {"path": "src/standalone/src/core/infra/executor.hpp", "symbol": "submit_result_t::task_id; executor::active_snapshot; executor::cancel", "claim": "The common executor projects runtime IDs and cancellation."},
        {"path": "src/standalone/src/core/analysis/analysis_scheduler.hpp", "symbol": "analysis_task_id_t; cancel_task; cancel_domain; task_snapshot; snapshot", "claim": "Analysis owns a separate typed task identity and terminal state."}
      ],
      "global_cancel_enabled": false,
      "cancel_contracts": [
        {"owner": "taskflow_runtime", "owner_symbol": "aida::infra::taskflow_runtime::cancel(job_handle_t)", "handle_type": "job_handle_t", "terminal_owner": "active_snapshot job_state_t"},
        {"owner": "executor", "owner_symbol": "aida::infra::executor::cancel(uint64_t)", "handle_type": "submit_result_t.task_id", "terminal_owner": "taskflow_runtime active snapshot"},
        {"owner": "analysis_scheduler", "owner_symbol": "analysis_scheduler_t::cancel_task(analysis_task_id_t)", "handle_type": "analysis_task_id_t", "terminal_owner": "analysis_task_snapshot_t.state"}
      ]
    },
    "G5": {
      "decision": "Initial Task Center history is bounded memory-only: at most 256 terminal successes for 24 hours and 512 failures/cancellations until acknowledged or seven days. Restart does not serialize callbacks, handles, arguments, request bodies, process bytes, tool payloads, credentials, license material, or chat content. Domain-owned existing persistence remains authoritative; the Task Center may reconstruct only redacted interrupted metadata explicitly published by that domain. Layout records contain geometry and stable view IDs only.",
      "evidence": [
        {"path": "src/standalone/src/core/settings/standalone_settings.hpp", "symbol": "sa_settings_detail::protect_key; workspace_state_t; settings_path", "claim": "Settings already separate protected secrets and workspace presentation state."},
        {"path": "src/standalone/src/core/workbench/workbench_persistence.cpp", "symbol": "preflight_json; k_persistence_codec_max_serialized_bytes; workspace_database_workbench_persistence_adapter_t", "claim": "Workbench state is bounded, workspace-scoped and domain-owned."},